{
  "id": "mesa-verde",
  "slug": "mesa-verde",
  "name": "Mesa Verde",
  "countryCode": "US",
  "countryName": "United States",
  "continent": "north-america",
  "regionSlugs": [
    "colorado",
    "north-america"
  ],
  "timezone": "America/Denver",
  "active": true,
  "priority": 91,
  "tags": [
    "dark-sky-park",
    "archaeology",
    "high-desert"
  ],
  "observationSiteIds": [
    "morefield-campground",
    "far-view-area"
  ],
  "stayAreaIds": [
    "cortez-colorado"
  ],
  "affiliateQuery": "Mesa Verde Colorado"
}
