{
  "id": "eifel",
  "slug": "eifel",
  "name": "Eifel Dark Sky Park",
  "countryCode": "DE",
  "countryName": "Germany",
  "continent": "europe",
  "regionSlugs": [
    "north-rhine-westphalia",
    "europe"
  ],
  "timezone": "Europe/Berlin",
  "active": true,
  "priority": 82,
  "tags": [
    "forest",
    "dark-sky",
    "volcanic",
    "accessible"
  ],
  "observationSiteIds": [
    "eifel-dark-sky"
  ],
  "stayAreaIds": [
    "schleiden"
  ],
  "affiliateQuery": "Eifel dark sky park Germany"
}
