{
  "id": "tsumkwe",
  "slug": "tsumkwe",
  "name": "Tsumkwe",
  "countryCode": "NA",
  "countryName": "Namibia",
  "continent": "africa",
  "regionSlugs": [
    "otjozondjupa",
    "africa"
  ],
  "timezone": "Africa/Windhoek",
  "active": true,
  "priority": 87,
  "tags": [
    "remote",
    "community",
    "savanna"
  ],
  "observationSiteIds": [
    "tsumkwe-country-lodge-guest-campsite",
    "tsumkwe-juhoansi-grashoek-campsite"
  ],
  "stayAreaIds": [
    "tsumkwe-country-lodge"
  ],
  "affiliateQuery": "Tsumkwe Namibia lodge camping"
}
