{
  "id": "el-leoncito",
  "slug": "el-leoncito",
  "name": "El Leoncito",
  "countryCode": "AR",
  "countryName": "Argentina",
  "continent": "south-america",
  "regionSlugs": [
    "san-juan",
    "south-america"
  ],
  "timezone": "America/Argentina/San_Juan",
  "active": true,
  "priority": 92,
  "tags": [
    "desert",
    "observatory",
    "very-dark",
    "high-altitude"
  ],
  "observationSiteIds": [
    "el-leoncito-observatory"
  ],
  "stayAreaIds": [
    "barreal"
  ],
  "affiliateQuery": "El Leoncito Argentina observatory"
}
