{
  "id": "la-silla",
  "slug": "la-silla",
  "name": "La Silla Observatory",
  "countryCode": "CL",
  "countryName": "Chile",
  "continent": "south-america",
  "regionSlugs": [
    "coquimbo",
    "south-america"
  ],
  "timezone": "America/Santiago",
  "active": true,
  "priority": 95,
  "tags": [
    "desert",
    "observatory",
    "very-dark",
    "high-altitude"
  ],
  "observationSiteIds": [
    "la-silla-observatory",
    "collowara-tourist-observatory"
  ],
  "stayAreaIds": [
    "vicuna"
  ],
  "affiliateQuery": "La Silla Observatory Chile"
}
